{
 "schema": "hardware-pipeline.instrument/0.1",
 "id": "room-weyl",
 "name": "Room-shape meter",
 "atlas_id": "room-weyl",
 "written": "2026-10-30",
 "summary": "Hearing a room's volume from its mode count with a laptop's own speaker and mic. Stages 2, 5, 7 and 9 are built and run; the rest are on paper.",
 "stages": [
  {
   "stage": 1,
   "key": "principle",
   "status": "passed",
   "inputs": [
    "ATLAS.json top5 room-weyl",
    "wall audit: 'you need a tape measure (or lidar) to know a room's size'"
   ],
   "outputs": [
    "Weyl's law with the rigid-wall corrections, the Sabine cross-check, and the assumptions"
   ],
   "gate": {
    "condition": "every assumption names a check that can fail",
    "metric": "assumptions without a check",
    "op": "==",
    "threshold": 0,
    "verdict": "pass",
    "measured": 0
   },
   "tools": [
    {
     "name": "ATLAS.json",
     "role": "source of the law and the wall",
     "licence": "ours",
     "ours": true
    },
    {
     "name": "CHECKS.json",
     "role": "named check techniques the stage uses",
     "licence": "ours",
     "ours": true,
     "lineage": "the private study 2026-10-30-checks"
    }
   ],
   "spec": {
    "law": {
     "name": "Weyl's law for the Neumann Laplacian, with surface and edge terms",
     "form": "N(f) = 4 pi V f^3 / (3 c^3) + pi S f^2 / (4 c^2) + L f / (8 c)",
     "catalogue_id": "weyl_law",
     "lineage": "Weyl (1911); rectangular-room corrections, Morse and Bolt (1944); Kac, 'Can one hear the shape of a drum?' (1966); Sabine (1900) for T60 = 0.161 V / A"
    },
    "quantity": "room volume V (and surface S, weakly)",
    "signal": "the count of resolved acoustic modes below f",
    "inversion": "fit V and kappa = S / V^(2/3) to the counted modes, corrected for the modes the estimator cannot split",
    "wall_assumptions": [
     {
      "assumption": "walls are rigid enough that modes are Neumann modes",
      "how_checked": "measured mode decay times are long (T60 above 0.3 s at low frequency)",
      "if_broken": "the surface term changes sign or vanishes; V biased"
     },
     {
      "assumption": "the source and the mic see every mode",
      "how_checked": "corner to opposite-corner protocol; corners are antinodes of every mode",
      "if_broken": "undercount; a mid-room mic misses about half"
     },
     {
      "assumption": "modes can be told apart",
      "how_checked": "known-answer injection with two modes 1 Hz apart (R1)",
      "if_broken": "undercount; this is the wall the matrix pencil attacks"
     },
     {
      "assumption": "mode spacing is Poisson (a box is integrable; Berry and Tabor 1977)",
      "how_checked": "the corrected count against the twin's truth",
      "if_broken": "the resolving correction is wrong for chaotic (irregular) rooms, whose spacings repel"
     },
     {
      "assumption": "the laptop records raw audio (no automatic gain, noise suppression or echo cancellation)",
      "how_checked": "electrical or acoustic loopback reads a flat, linear response",
      "if_broken": "the decay and the spectrum are rewritten by DSP; UNCAL"
     }
    ],
    "fundamental_bound": "modes merge when their spacing falls below the resolving width; the Schroeder frequency 2000 sqrt(T60 / V) marks where counting ends for any method"
   },
   "does_not_prove": "Weyl's law gives the volume of the space the sound fills, which in a furnished room is less than the tape-measured box."
  },
  {
   "stage": 2,
   "key": "twin",
   "status": "run",
   "inputs": [
    "stage 1",
    "speaker and mic models"
   ],
   "outputs": [
    "room/modes.py, chain.py, meter.py, pencil.py, trial.py: a seeded twin of room, chain and estimator"
   ],
   "gate": {
    "condition": "the preregistered kill condition: median laptop volume error below 0.25",
    "metric": "median |V_est / V - 1|, laptop",
    "op": "<",
    "threshold": 0.25,
    "verdict": "pass",
    "measured": 0.144,
    "evidence": "studies/room/out/20261031T003606Z/result.json"
   },
   "tools": [
    {
     "name": "Python 3.12 and NumPy",
     "role": "simulation and analysis",
     "licence": "PSF-2.0 and BSD-3-Clause",
     "ours": false,
     "lineage": "NumPy: Oliphant (2006), from Numeric (Hugunin, 1995)"
    },
    {
     "name": "studyrun",
     "role": "preregistration lock, controls, verdicts",
     "licence": "ours",
     "ours": true,
     "lineage": "the private study 2026-10-29-pipelines"
    }
   ],
   "spec": {
    "model": "rigid shoebox, every mode below 900 Hz, log-normal mode damping; 10 s exponential sweep; 16-bit DAC; speaker as a 2nd-order high-pass plus 2nd and 3rd harmonic distortion; red room noise and mic self-noise; MEMS sensitivity; 16-bit ADC at the 48 kHz noise density; regularised Farina deconvolution",
    "code": [
     "room/modes.py",
     "room/chain.py",
     "room/meter.py",
     "room/pencil.py",
     "room/trial.py",
     "room/units_room.py"
    ],
    "noise_sources": [
     {
      "name": "background room noise",
      "formula": "red spectrum, 1/f power, 20 to 1000 Hz",
      "value": "30 or 45 dB SPL equivalent"
     },
     {
      "name": "mic self-noise",
      "formula": "white, equivalent input noise",
      "value": "29 dB SPL (a MEMS-class figure, from memory, moderate)"
     },
     {
      "name": "quantisation",
      "formula": "q / sqrt(12) at 16 bits, density of a 48 kHz converter",
      "value": "about -101 dBFS per 48 kHz band"
     },
     {
      "name": "speaker distortion",
      "formula": "0.03 x^2 + 0.02 x^3",
      "value": "pushed to negative time by the sweep method"
     }
    ],
    "bounds": [
     {
      "name": "modal bandwidth",
      "formula": "B = 2.2 / T60",
      "value": "2.4 to 7 Hz for T60 0.3 to 0.9 s"
     },
     {
      "name": "Schroeder frequency",
      "formula": "2000 sqrt(T60 / V)",
      "value": "about 150 to 400 Hz for these rooms"
     },
     {
      "name": "speaker roll-off",
      "formula": "12 dB per octave below fc",
      "value": "fc 20, 150, 400 Hz for ideal, laptop, phone"
     }
    ],
    "known_answer_tests": [
     {
      "name": "electrical loopback (R0)",
      "truth": "loopback gain times a unit impulse",
      "pass_condition": "error below -60 dB",
      "result": "-91.0 dB"
     },
     {
      "name": "six planted modes, two 1 Hz apart (R1)",
      "truth": "planted frequencies and decay times",
      "pass_condition": "each within 0.2 Hz and 15 percent",
      "result": "worst 0.075 Hz; 4 spurious poles"
     },
     {
      "name": "real-recording path, WAV files only",
      "truth": "the same six planted modes at 48 kHz",
      "pass_condition": "each within 0.05 Hz and 5 percent",
      "result": "pass"
     }
    ]
   },
   "does_not_prove": "The twin is a rigid shoebox with an ideal corner protocol; furniture, open doors, irregular plans and real laptop DSP are absent.",
   "notes": "Preregistered run 20261031T003606Z: V1 PASS, V2 FAIL, V3 PASS, V4 FAIL, V5 FAIL, V6 PASS, V7 PASS. Laptop median errors: naive Fourier count 0.74, corrected Fourier 0.44, matrix pencil 0.14, shoebox prior 0.24, prior guess 0.32. A known-answer test of the WAV path then found a circular-filter bug in the T60 step (deviation D1). Post hoc run 20261031T004139Z with the fix: V2 PASS, V4 PASS, V5 FAIL; laptop pencil median 0.16, gap to the prior guess 0.23 (CI 0.14 to 0.32)."
  },
  {
   "stage": 3,
   "key": "front_end",
   "status": "existing-device",
   "inputs": [
    "the laptop or phone in hand"
   ],
   "outputs": [
    "a device profile: speaker roll-off, mic response, raw-capture mode, ADC format"
   ],
   "gate": {
    "condition": "the device profile is measured, not assumed: loopback flat within 1 dB over 40 to 150 Hz after the speaker correction",
    "metric": "max deviation, dB",
    "op": "<",
    "threshold": 1.0,
    "verdict": "open"
   },
   "tools": [
    {
     "name": "any recorder that writes 16-bit PCM WAV with effects off (Audacity, for example)",
     "role": "capture",
     "licence": "GPL-2.0-or-later (Audacity, from memory, moderate)",
     "ours": false
    }
   ],
   "spec": {
    "existing_device": true,
    "chain": [
     {
      "element": "speaker",
      "part_or_device": "built-in laptop speaker",
      "key_spec": "low-frequency corner near 150 Hz in the twin; measure it"
     },
     {
      "element": "mic",
      "part_or_device": "built-in MEMS mic, or a phone as the mic",
      "key_spec": "raw mode, no AGC"
     },
     {
      "element": "ADC",
      "part_or_device": "the device's codec at 48 kHz, 16-bit",
      "key_spec": "no resampling in the capture path"
     }
    ],
    "noise_budget": [
     {
      "source": "background room noise",
      "density": "30 dB quiet night, 45 dB daytime",
      "share_of_total": "dominant below 100 Hz"
     },
     {
      "source": "mic self-noise",
      "density": "29 dB SPL",
      "share_of_total": "dominant in a very quiet room"
     },
     {
      "source": "converter",
      "density": "16-bit at 48 kHz",
      "share_of_total": "negligible after the 10 s sweep's processing gain"
     }
    ],
    "adc": {
     "bits": 16,
     "fs_hz": 48000,
     "enob_or_floor": "measured by the silence capture (auto-zero)"
    },
    "margin_to_bound": "the round trip keeps 8.4 of 18.3 bits per bin in 40 to 150 Hz; the estimator, not the converter, sets the error"
   },
   "does_not_prove": "A measured profile holds for one device in one mode; an OS update can switch DSP back on."
  },
  {
   "stage": 4,
   "key": "schematic_pcb",
   "status": "existing-device",
   "inputs": [
    "stage 3"
   ],
   "outputs": [
    "no board; a recorded device identity instead"
   ],
   "gate": {
    "condition": "the device identity (model, OS build, audio driver, capture settings) is recorded in every receipt",
    "metric": "receipts without device identity",
    "op": "==",
    "threshold": 0,
    "verdict": "open"
   },
   "tools": [
    {